{
  "schemaVersion": "1.0.0",
  "jumpId": "33333333-3333-4333-8333-333333333333",
  "sessionId": "11111111-1111-4111-8111-111111111111",
  "sequence": 6,
  "takeoffAt": "2026-08-29T10:31:14.200Z",
  "apexAt": "2026-08-29T10:31:16.100Z",
  "landingAt": "2026-08-29T10:31:18.400Z",
  "heightMeters": 8.7,
  "airtimeMilliseconds": 4200,
  "horizontalDistanceMeters": 21.4,
  "takeoffSpeedMps": 10.6,
  "landingSpeedMps": 9.8,
  "takeoffPosition": {
    "latitudeDegrees": 36.0123,
    "longitudeDegrees": -5.6123,
    "horizontalAccuracyMeters": 4.2
  },
  "confidence": 0.82,
  "algorithmVersion": "jump-engine-height-v1",
  "qualityFlags": ["barometer_unavailable"],
  "sourceSensorSummary": {
    "strategy": "gps_imu",
    "sampleCounts": { "gps": 5, "accelerometer": 210, "gyroscope": 210 }
  }
}
